RowID,DateTimeStart,DateTimeEnd,Title,Location,ForMultipleCandidates,CancelledOrRescheduled,PositionIDList,URL,Notes
1,2022-10-22 14:30:00,2022-10-22 16:30:00,Kids Vote,"Waterloo Public Library, 35 Albert St, Waterloo, ON",,,Alias-CityWaterloo,https://wpl.libnet.info/event/6997860,Registration Required
2,2022-09-18 14:00:00,2022-09-18 16:00:00,Meet Mary Lou Roe,"Warrington Park, 397 Warrington Park, Waterloo, ON",,,Waterloo-Ward-06,https://twitter.com/Mary_Lou_Roe/status/1569368680802271232,
3,2022-09-21 19:00:00,2022-09-21 21:00:00,Ward 9 Councillor Candidates Meeting,"Calvary Memorial United Church, 91 Gruhn St, Kitchener, ON",Y,,Kitchener-Ward-09,https://cherrypark.blogspot.com/2022/09/ward-9-city-councillor-all-candidate.html,Masks required
4,2022-10-02 14:00:00,2022-10-02 15:30:00,"Meet the Ward 10 Candidates, October 2nd","Downtown Community Centre, 35B Weber St W, Kitchener, ON",Y,,Kitchener-Ward-10,http://www.mhbpna.org/2022/09/12/meet-the-ward-10-candidates-october-2nd/,
5,2022-10-15 18:00:00,2022-10-15 19:00:00,Jim and Belinda Karahalios Meet and Greet (Galt),Galt,,,"Cambridge-Ward-05, Cambridge-Ward-03",https://twitter.com/BKarahalios/status/1569744770817196033,RSVP for meeting location
6,2022-10-16 18:00:00,2022-10-16 19:00:00,Jim and Belinda Karahalios Meet and Greet (Preston),Preston,,,"Cambridge-Ward-05, Cambridge-Ward-03",https://twitter.com/BKarahalios/status/1569744770817196033,RSVP for meeting location
7,2022-09-29 19:00:00,2022-09-29 21:00:00,Ward 7 and Mayoral Debate,"Waterloo Memorial Rec Complex, 101 Father David Bauer Drive, Waterloo, ON",Y,,"Waterloo-Ward-07,Waterloo-Mayor",https://www.facebook.com/maryallenneighbourhood/posts/pfbid02tym1CcKamGV3AuWbVKV8ebTRNxei4WGWvYfAXXGs9zVrjfBzhUvm1YckpWFTaPD5l,
8,2022-10-19 19:00:00,2022-10-19 21:00:00,Regional Councillors Debate (Waterloo),"Waterloo Memorial Rec Complex, 101 Father David Bauer Drive, Waterloo, ON",Y,,Regional-Waterloo,https://www.facebook.com/maryallenneighbourhood/posts/pfbid02tym1CcKamGV3AuWbVKV8ebTRNxei4WGWvYfAXXGs9zVrjfBzhUvm1YckpWFTaPD5l,
